==========================================
SLURM_JOB_ID = 4619389
SLURM_JOB_NODELIST = a01-06
TMPDIR = /tmp/SLURM_4619389
==========================================

==========================================
🚀 GRPO Model Inference Job Starting
==========================================
Job started at: Fri Oct 31 00:18:04 PDT 2025
Running on hosts: a01-06
Running on 1 nodes
Running on 1 processors
GPU allocation: 0
==========================================

Current working directory: /home1/yihelu/csci566
📊 Starting GRPO model inference...
`torch_dtype` is deprecated! Use `dtype` instead!
PyTorch version: 2.8.0+cu128
CUDA available: True
CUDA version: 12.8
GPU count: 1
GPU name: NVIDIA A100-PCIE-40GB
Loading dataset...
Loaded 395 test samples
Loading base model...
Loading GRPO LoRA adapter...
Found 2 checkpoints, using latest: qwen_grpo_lora_multigpu/checkpoint-462
✅ Found GRPO LoRA adapter at: /home1/yihelu/csci566/qwen_grpo_lora_multigpu/checkpoint-462

======================================================================
🚀 Starting GRPO model inference...
📊 Test samples: 395
🎯 Evaluation metric: Accuracy
🔧 Generation mode: Deterministic (temperature=0.0)
======================================================================

Evaluating:   0%|          | 0/395 [00:00<?, ?it/s]The following generation flags are not valid and may be ignored: ['temperature']. Set `TRANSFORMERS_VERBOSITY=info` for more details.
Evaluating:   0%|          | 1/395 [00:11<1:16:54, 11.71s/it]Evaluating:   1%|          | 2/395 [00:17<52:03,  7.95s/it]  Evaluating:   1%|          | 3/395 [00:30<1:09:26, 10.63s/it]Evaluating:   1%|          | 4/395 [00:41<1:10:35, 10.83s/it]Evaluating:   1%|▁         | 5/395 [00:46<55:09,  8.49s/it]  Evaluating:   2%|▁         | 6/395 [00:53<51:53,  8.01s/it]Evaluating:   2%|▁         | 7/395 [00:57<44:32,  6.89s/it]Evaluating:   2%|▁         | 8/395 [01:03<40:45,  6.32s/it]Evaluating:   2%|▁         | 9/395 [01:07<36:23,  5.66s/it]Evaluating:   3%|▎         | 10/395 [01:17<46:07,  7.19s/it]Evaluating:   3%|▎         | 11/395 [01:21<38:36,  6.03s/it]Evaluating:   3%|▎         | 12/395 [01:25<35:27,  5.56s/it]Evaluating:   3%|▎         | 13/395 [01:30<33:31,  5.26s/it]Evaluating:   4%|▎         | 14/395 [01:36<35:32,  5.60s/it]Evaluating:   4%|▁         | 15/395 [01:42<35:17,  5.57s/it]Evaluating:   4%|▁         | 16/395 [01:52<44:48,  7.09s/it]Evaluating:   4%|▁         | 17/395 [01:58<41:49,  6.64s/it]Evaluating:   5%|▁         | 18/395 [02:01<35:30,  5.65s/it]Evaluating:   5%|▁         | 19/395 [02:13<45:51,  7.32s/it]Evaluating:   5%|▌         | 20/395 [02:20<46:31,  7.45s/it]Evaluating:   5%|▌         | 21/395 [02:26<42:40,  6.84s/it]Evaluating:   6%|▌         | 22/395 [02:26<31:09,  5.01s/it]Evaluating:   6%|▌         | 23/395 [02:42<51:38,  8.33s/it]Evaluating:   6%|▌         | 24/395 [03:16<1:38:25, 15.92s/it]Evaluating:   6%|▋         | 25/395 [03:20<1:16:44, 12.44s/it]Evaluating:   7%|▋         | 26/395 [03:32<1:14:55, 12.18s/it]Evaluating:   7%|▋         | 27/395 [03:42<1:11:25, 11.65s/it]Evaluating:   7%|▋         | 28/395 [03:47<58:56,  9.64s/it]  Evaluating:   7%|▋         | 29/395 [03:52<49:57,  8.19s/it]Evaluating:   8%|▊         | 30/395 [03:58<45:21,  7.46s/it]Evaluating:   8%|▊         | 31/395 [04:02<38:37,  6.37s/it]Evaluating:   8%|▊         | 32/395 [04:06<35:19,  5.84s/it]Evaluating:   8%|▊         | 33/395 [04:19<47:17,  7.84s/it]Evaluating:   9%|▊         | 34/395 [04:27<47:18,  7.86s/it]Evaluating:   9%|▉         | 35/395 [04:35<47:14,  7.87s/it]Evaluating:   9%|▉         | 36/395 [04:44<49:02,  8.20s/it]Evaluating:   9%|▉         | 37/395 [04:49<44:43,  7.50s/it]Evaluating:  10%|▉         | 38/395 [04:59<49:00,  8.24s/it]Evaluating:  10%|▉         | 39/395 [05:09<50:36,  8.53s/it]Evaluating:  10%|█         | 40/395 [05:14<45:02,  7.61s/it]Evaluating:  10%|█         | 41/395 [05:22<44:44,  7.58s/it]Evaluating:  11%|█         | 42/395 [05:29<44:45,  7.61s/it]Evaluating:  11%|█         | 43/395 [05:40<50:27,  8.60s/it]Evaluating:  11%|█         | 44/395 [05:44<41:00,  7.01s/it]Evaluating:  11%|█▁        | 45/395 [05:53<44:51,  7.69s/it]Evaluating:  12%|█▁        | 46/395 [05:59<41:55,  7.21s/it]Evaluating:  12%|█▁        | 47/395 [06:10<49:11,  8.48s/it]Evaluating:  12%|█▁        | 48/395 [06:16<43:56,  7.60s/it]Evaluating:  12%|█▁        | 49/395 [06:23<42:53,  7.44s/it]Evaluating:  13%|█▎        | 50/395 [06:24<31:19,  5.45s/it]Evaluating:  13%|█▎        | 51/395 [06:25<23:34,  4.11s/it]Evaluating:  13%|█▎        | 52/395 [06:39<40:05,  7.01s/it]Evaluating:  13%|█▎        | 53/395 [06:46<41:23,  7.26s/it]Evaluating:  14%|█▎        | 54/395 [06:52<37:59,  6.68s/it]Evaluating:  14%|█▁        | 55/395 [07:00<40:22,  7.12s/it]Evaluating:  14%|█▁        | 56/395 [07:06<38:38,  6.84s/it]Evaluating:  14%|█▁        | 57/395 [07:13<38:57,  6.92s/it]Evaluating:  15%|█▁        | 58/395 [07:22<42:14,  7.52s/it]Evaluating:  15%|█▁        | 59/395 [07:30<42:43,  7.63s/it]Evaluating:  15%|█▌        | 60/395 [07:37<41:15,  7.39s/it]Evaluating:  15%|█▌        | 61/395 [07:41<36:27,  6.55s/it]Evaluating:  16%|█▌        | 62/395 [07:58<53:12,  9.59s/it]Evaluating:  16%|█▌        | 63/395 [08:05<48:47,  8.82s/it]Evaluating:  16%|█▌        | 64/395 [08:08<38:24,  6.96s/it]Evaluating:  16%|█▋        | 65/395 [08:16<41:18,  7.51s/it]Evaluating:  17%|█▋        | 66/395 [08:23<39:25,  7.19s/it]Evaluating:  17%|█▋        | 67/395 [08:28<36:00,  6.59s/it]Evaluating:  17%|█▋        | 68/395 [08:46<54:15,  9.96s/it]Evaluating:  17%|█▋        | 69/395 [08:50<44:30,  8.19s/it]Evaluating:  18%|█▊        | 70/395 [09:00<46:43,  8.63s/it]Evaluating:  18%|█▊        | 71/395 [09:09<47:22,  8.77s/it]Evaluating:  18%|█▊        | 72/395 [09:23<56:36, 10.51s/it]Evaluating:  18%|█▊        | 73/395 [09:40<1:06:08, 12.32s/it]Evaluating:  19%|█▊        | 74/395 [10:06<1:27:27, 16.35s/it]Evaluating:  19%|█▉        | 75/395 [10:13<1:12:22, 13.57s/it]Evaluating:  19%|█▉        | 76/395 [10:20<1:02:07, 11.69s/it]Evaluating:  19%|█▉        | 77/395 [10:24<50:20,  9.50s/it]  Evaluating:  20%|█▉        | 78/395 [10:37<54:41, 10.35s/it]Evaluating:  20%|██        | 79/395 [10:42<46:08,  8.76s/it]Evaluating:  20%|██        | 80/395 [10:48<41:55,  7.99s/it]Evaluating:  21%|██        | 81/395 [10:57<43:40,  8.35s/it]Evaluating:  21%|██        | 82/395 [11:04<40:45,  7.81s/it]Evaluating:  21%|██        | 83/395 [11:08<35:11,  6.77s/it]Evaluating:  21%|██▁       | 84/395 [11:19<42:18,  8.16s/it]Evaluating:  22%|██▁       | 85/395 [11:23<34:18,  6.64s/it]Evaluating:  22%|██▁       | 86/395 [11:40<51:29, 10.00s/it]Evaluating:  22%|██▁       | 87/395 [11:47<46:26,  9.05s/it]Evaluating:  22%|██▁       | 88/395 [11:54<43:35,  8.52s/it]Evaluating:  23%|██▎       | 89/395 [12:08<51:42, 10.14s/it]Evaluating:  23%|██▎       | 90/395 [12:14<44:58,  8.85s/it]Evaluating:  23%|██▎       | 91/395 [12:18<37:16,  7.36s/it]Evaluating:  23%|██▎       | 92/395 [12:24<35:33,  7.04s/it]Evaluating:  24%|██▎       | 93/395 [12:27<28:35,  5.68s/it]Evaluating:  24%|██▁       | 94/395 [12:32<27:15,  5.43s/it]Evaluating:  24%|██▁       | 95/395 [12:37<26:53,  5.38s/it]Evaluating:  24%|██▁       | 96/395 [12:44<29:27,  5.91s/it]Evaluating:  25%|██▁       | 97/395 [13:00<43:47,  8.82s/it]Evaluating:  25%|██▁       | 98/395 [13:06<40:30,  8.18s/it]Evaluating:  25%|██▌       | 99/395 [13:16<41:44,  8.46s/it]Evaluating:  25%|██▌       | 100/395 [13:25<43:32,  8.85s/it]Evaluating:  26%|██▌       | 101/395 [13:31<38:39,  7.89s/it]Evaluating:  26%|██▌       | 102/395 [13:39<38:59,  7.98s/it]Evaluating:  26%|██▌       | 103/395 [13:43<32:51,  6.75s/it]Evaluating:  26%|██▋       | 104/395 [13:47<29:13,  6.03s/it]Evaluating:  27%|██▋       | 105/395 [13:56<32:07,  6.65s/it]Evaluating:  27%|██▋       | 106/395 [14:04<34:33,  7.18s/it]Evaluating:  27%|██▋       | 107/395 [14:25<54:15, 11.30s/it]Evaluating:  27%|██▋       | 108/395 [14:35<52:15, 10.92s/it]Evaluating:  28%|██▊       | 109/395 [14:44<49:24, 10.37s/it]Evaluating:  28%|██▊       | 110/395 [14:52<46:17,  9.75s/it]Evaluating:  28%|██▊       | 111/395 [14:58<39:56,  8.44s/it]Evaluating:  28%|██▊       | 112/395 [15:11<46:03,  9.77s/it]Evaluating:  29%|██▊       | 113/395 [15:14<37:41,  8.02s/it]Evaluating:  29%|██▉       | 114/395 [15:20<34:01,  7.27s/it]Evaluating:  29%|██▉       | 115/395 [15:28<35:20,  7.57s/it]Evaluating:  29%|██▉       | 116/395 [15:42<44:19,  9.53s/it]Evaluating:  30%|██▉       | 117/395 [15:51<43:25,  9.37s/it]Evaluating:  30%|██▉       | 118/395 [15:57<37:56,  8.22s/it]Evaluating:  30%|███       | 119/395 [16:04<36:03,  7.84s/it]Evaluating:  30%|███       | 120/395 [16:12<35:54,  7.83s/it]Evaluating:  31%|███       | 121/395 [16:16<30:43,  6.73s/it]Evaluating:  31%|███       | 122/395 [16:22<30:07,  6.62s/it]Evaluating:  31%|███       | 123/395 [16:31<32:42,  7.21s/it]Evaluating:  31%|███▁      | 124/395 [16:35<28:18,  6.27s/it]Evaluating:  32%|███▁      | 125/395 [16:45<33:58,  7.55s/it]Evaluating:  32%|███▁      | 126/395 [16:49<28:54,  6.45s/it]Evaluating:  32%|███▁      | 127/395 [16:55<27:21,  6.13s/it]Evaluating:  32%|███▁      | 128/395 [17:05<32:32,  7.31s/it]Evaluating:  33%|███▎      | 129/395 [17:09<28:42,  6.47s/it]Evaluating:  33%|███▎      | 130/395 [17:14<26:20,  5.97s/it]Evaluating:  33%|███▎      | 131/395 [17:25<32:31,  7.39s/it]Evaluating:  33%|███▎      | 132/395 [17:30<29:33,  6.74s/it]Evaluating:  34%|███▎      | 133/395 [17:37<29:10,  6.68s/it]Evaluating:  34%|███▁      | 134/395 [17:57<46:35, 10.71s/it]Evaluating:  34%|███▁      | 135/395 [18:02<38:57,  8.99s/it]Evaluating:  34%|███▁      | 136/395 [18:07<34:16,  7.94s/it]Evaluating:  35%|███▁      | 137/395 [18:12<30:27,  7.08s/it]Evaluating:  35%|███▁      | 138/395 [18:16<26:46,  6.25s/it]Evaluating:  35%|███▌      | 139/395 [18:18<20:46,  4.87s/it]Evaluating:  35%|███▌      | 140/395 [18:52<57:03, 13.43s/it]Evaluating:  36%|███▌      | 141/395 [19:05<57:27, 13.57s/it]Evaluating:  36%|███▌      | 142/395 [19:14<51:28, 12.21s/it]Evaluating:  36%|███▌      | 143/395 [19:25<48:44, 11.60s/it]Evaluating:  36%|███▋      | 144/395 [19:31<42:09, 10.08s/it]Evaluating:  37%|███▋      | 145/395 [19:36<35:35,  8.54s/it]Evaluating:  37%|███▋      | 146/395 [19:46<37:35,  9.06s/it]Evaluating:  37%|███▋      | 147/395 [19:51<31:23,  7.60s/it]Evaluating:  37%|███▋      | 148/395 [20:06<40:48,  9.91s/it]Evaluating:  38%|███▊      | 149/395 [20:15<39:03,  9.53s/it]Evaluating:  38%|███▊      | 150/395 [20:25<40:26,  9.90s/it]Evaluating:  38%|███▊      | 151/395 [20:39<45:18, 11.14s/it]Evaluating:  38%|███▊      | 152/395 [20:48<42:37, 10.53s/it]Evaluating:  39%|███▊      | 153/395 [20:59<42:08, 10.45s/it]Evaluating:  39%|███▉      | 154/395 [21:07<39:59,  9.96s/it]Evaluating:  39%|███▉      | 155/395 [21:15<37:16,  9.32s/it]Evaluating:  39%|███▉      | 156/395 [21:16<27:05,  6.80s/it]Evaluating:  40%|███▉      | 157/395 [21:31<36:56,  9.31s/it]Evaluating:  40%|████      | 158/395 [21:43<39:42, 10.05s/it]Evaluating:  40%|████      | 159/395 [21:51<36:32,  9.29s/it]Evaluating:  41%|████      | 160/395 [21:57<32:26,  8.28s/it]Evaluating:  41%|████      | 161/395 [22:08<35:36,  9.13s/it]Evaluating:  41%|████      | 162/395 [22:11<28:52,  7.44s/it]Evaluating:  41%|████▁     | 163/395 [22:18<28:14,  7.30s/it]Evaluating:  42%|████▁     | 164/395 [22:25<27:55,  7.25s/it]Evaluating:  42%|████▁     | 165/395 [22:32<27:03,  7.06s/it]Evaluating:  42%|████▁     | 166/395 [22:38<26:03,  6.83s/it]Evaluating:  42%|████▁     | 167/395 [22:43<23:44,  6.25s/it]Evaluating:  43%|████▎     | 168/395 [22:52<26:15,  6.94s/it]Evaluating:  43%|████▎     | 169/395 [22:57<24:03,  6.39s/it]Evaluating:  43%|████▎     | 170/395 [23:05<25:30,  6.80s/it]Evaluating:  43%|████▎     | 171/395 [23:15<29:31,  7.91s/it]Evaluating:  44%|████▎     | 172/395 [23:25<31:07,  8.38s/it]Evaluating:  44%|████▁     | 173/395 [23:31<28:44,  7.77s/it]Evaluating:  44%|████▁     | 174/395 [23:40<30:25,  8.26s/it]Evaluating:  44%|████▁     | 175/395 [23:51<32:36,  8.89s/it]Evaluating:  45%|████▁     | 176/395 [23:55<27:22,  7.50s/it]Evaluating:  45%|████▁     | 177/395 [24:01<25:12,  6.94s/it]Evaluating:  45%|████▌     | 178/395 [24:06<23:14,  6.43s/it]Evaluating:  45%|████▌     | 179/395 [24:12<23:20,  6.48s/it]Evaluating:  46%|████▌     | 180/395 [24:46<52:11, 14.57s/it]Evaluating:  46%|████▌     | 181/395 [25:00<51:15, 14.37s/it]Evaluating:  46%|████▌     | 182/395 [25:08<44:41, 12.59s/it]Evaluating:  46%|████▋     | 183/395 [25:13<36:28, 10.32s/it]Evaluating:  47%|████▋     | 184/395 [25:18<29:57,  8.52s/it]Evaluating:  47%|████▋     | 185/395 [25:31<34:48,  9.94s/it]Evaluating:  47%|████▋     | 186/395 [25:36<29:50,  8.57s/it]Evaluating:  47%|████▋     | 187/395 [25:41<25:45,  7.43s/it]Evaluating:  48%|████▊     | 188/395 [25:48<25:46,  7.47s/it]Evaluating:  48%|████▊     | 189/395 [26:01<31:04,  9.05s/it]Evaluating:  48%|████▊     | 190/395 [26:35<55:56, 16.37s/it]Evaluating:  48%|████▊     | 191/395 [26:44<48:09, 14.16s/it]Evaluating:  49%|████▊     | 192/395 [26:48<38:07, 11.27s/it]Evaluating:  49%|████▉     | 193/395 [26:56<34:40, 10.30s/it]Evaluating:  49%|████▉     | 194/395 [27:04<31:45,  9.48s/it]Evaluating:  49%|████▉     | 195/395 [27:14<32:14,  9.67s/it]Evaluating:  50%|████▉     | 196/395 [27:26<34:29, 10.40s/it]Evaluating:  50%|████▉     | 197/395 [27:39<36:26, 11.04s/it]Evaluating:  50%|█████     | 198/395 [27:43<29:18,  8.93s/it]Evaluating:  50%|█████     | 199/395 [27:49<27:11,  8.33s/it]Evaluating:  51%|█████     | 200/395 [27:52<21:07,  6.50s/it]Evaluating:  51%|█████     | 201/395 [28:06<28:40,  8.87s/it]Evaluating:  51%|█████     | 202/395 [28:21<34:12, 10.64s/it]Evaluating:  51%|█████▁    | 203/395 [28:28<30:13,  9.44s/it]Evaluating:  52%|█████▁    | 204/395 [28:35<28:35,  8.98s/it]Evaluating:  52%|█████▁    | 205/395 [28:50<33:56, 10.72s/it]Evaluating:  52%|█████▁    | 206/395 [28:57<30:00,  9.52s/it]Evaluating:  52%|█████▁    | 207/395 [29:20<42:06, 13.44s/it]Evaluating:  53%|█████▎    | 208/395 [29:23<32:07, 10.31s/it]Evaluating:  53%|█████▎    | 209/395 [29:27<26:41,  8.61s/it]Evaluating:  53%|█████▎    | 210/395 [29:36<26:59,  8.75s/it]Evaluating:  53%|█████▎    | 211/395 [29:49<30:20,  9.89s/it]Evaluating:  54%|█████▎    | 212/395 [29:52<23:59,  7.87s/it]Evaluating:  54%|█████▁    | 213/395 [30:02<25:32,  8.42s/it]Evaluating:  54%|█████▁    | 214/395 [30:25<38:56, 12.91s/it]Evaluating:  54%|█████▁    | 215/395 [30:58<57:11, 19.06s/it]Evaluating:  55%|█████▁    | 216/395 [31:03<44:11, 14.81s/it]Evaluating:  55%|█████▁    | 217/395 [31:12<38:44, 13.06s/it]Evaluating:  55%|█████▌    | 218/395 [31:23<36:48, 12.48s/it]Evaluating:  55%|█████▌    | 219/395 [31:34<34:46, 11.86s/it]Evaluating:  56%|█████▌    | 220/395 [31:41<30:06, 10.32s/it]Evaluating:  56%|█████▌    | 221/395 [32:14<50:05, 17.27s/it]Evaluating:  56%|█████▌    | 222/395 [32:16<36:27, 12.64s/it]Evaluating:  56%|█████▋    | 223/395 [32:25<33:28, 11.68s/it]Evaluating:  57%|█████▋    | 224/395 [32:45<39:51, 13.98s/it]Evaluating:  57%|█████▋    | 225/395 [33:11<49:53, 17.61s/it]Evaluating:  57%|█████▋    | 226/395 [33:20<42:17, 15.02s/it]Evaluating:  57%|█████▋    | 227/395 [33:29<37:14, 13.30s/it]Evaluating:  58%|█████▊    | 228/395 [33:33<28:54, 10.39s/it]Evaluating:  58%|█████▊    | 229/395 [33:39<25:16,  9.13s/it]Evaluating:  58%|█████▊    | 230/395 [33:52<28:16, 10.28s/it]Evaluating:  58%|█████▊    | 231/395 [34:09<34:08, 12.49s/it]Evaluating:  59%|█████▊    | 232/395 [34:15<28:01, 10.32s/it]Evaluating:  59%|█████▉    | 233/395 [34:23<26:12,  9.71s/it]Evaluating:  59%|█████▉    | 234/395 [34:30<24:14,  9.03s/it]Evaluating:  59%|█████▉    | 235/395 [34:34<20:00,  7.50s/it]Evaluating:  60%|█████▉    | 236/395 [34:49<25:36,  9.66s/it]Evaluating:  60%|██████    | 237/395 [34:56<23:30,  8.92s/it]Evaluating:  60%|██████    | 238/395 [35:06<23:38,  9.03s/it]Evaluating:  61%|██████    | 239/395 [35:11<21:01,  8.09s/it]Evaluating:  61%|██████    | 240/395 [35:23<23:35,  9.13s/it]Evaluating:  61%|██████    | 241/395 [35:33<24:28,  9.54s/it]Evaluating:  61%|██████▁   | 242/395 [35:53<31:41, 12.43s/it]Evaluating:  62%|██████▁   | 243/395 [36:05<31:32, 12.45s/it]Evaluating:  62%|██████▁   | 244/395 [36:10<25:34, 10.16s/it]Evaluating:  62%|██████▁   | 245/395 [36:14<20:25,  8.17s/it]Evaluating:  62%|██████▁   | 246/395 [36:20<19:04,  7.68s/it]Evaluating:  63%|██████▎   | 247/395 [36:21<13:45,  5.58s/it]Evaluating:  63%|██████▎   | 248/395 [36:26<13:10,  5.38s/it]Evaluating:  63%|██████▎   | 249/395 [36:35<16:16,  6.69s/it]Evaluating:  63%|██████▎   | 250/395 [36:40<14:26,  5.97s/it]Evaluating:  64%|██████▎   | 251/395 [36:46<14:16,  5.95s/it]Evaluating:  64%|██████▁   | 252/395 [36:50<13:25,  5.64s/it]Evaluating:  64%|██████▁   | 253/395 [36:56<13:13,  5.59s/it]Evaluating:  64%|██████▁   | 254/395 [37:01<12:25,  5.28s/it]Evaluating:  65%|██████▁   | 255/395 [37:12<16:49,  7.21s/it]Evaluating:  65%|██████▁   | 256/395 [37:25<20:29,  8.85s/it]Evaluating:  65%|██████▌   | 257/395 [37:46<28:29, 12.39s/it]Evaluating:  65%|██████▌   | 258/395 [37:54<25:45, 11.28s/it]Evaluating:  66%|██████▌   | 259/395 [38:04<24:39, 10.88s/it]Evaluating:  66%|██████▌   | 260/395 [38:20<27:56, 12.42s/it]Evaluating:  66%|██████▌   | 261/395 [38:31<26:53, 12.04s/it]Evaluating:  66%|██████▋   | 262/395 [38:40<24:38, 11.11s/it]Evaluating:  67%|██████▋   | 263/395 [38:50<23:32, 10.70s/it]Evaluating:  67%|██████▋   | 264/395 [39:04<25:12, 11.55s/it]Evaluating:  67%|██████▋   | 265/395 [39:12<22:47, 10.52s/it]Evaluating:  67%|██████▋   | 266/395 [39:32<28:56, 13.46s/it]Evaluating:  68%|██████▊   | 267/395 [39:39<24:44, 11.60s/it]Evaluating:  68%|██████▊   | 268/395 [39:48<23:01, 10.88s/it]Evaluating:  68%|██████▊   | 269/395 [39:58<21:45, 10.36s/it]Evaluating:  68%|██████▊   | 270/395 [40:08<21:36, 10.37s/it]Evaluating:  69%|██████▊   | 271/395 [40:15<19:06,  9.24s/it]Evaluating:  69%|██████▉   | 272/395 [40:20<16:40,  8.14s/it]Evaluating:  69%|██████▉   | 273/395 [40:27<15:46,  7.76s/it]Evaluating:  69%|██████▉   | 274/395 [40:31<13:14,  6.57s/it]Evaluating:  70%|██████▉   | 275/395 [40:35<11:25,  5.72s/it]Evaluating:  70%|██████▉   | 276/395 [40:43<12:41,  6.40s/it]Evaluating:  70%|███████   | 277/395 [40:48<11:51,  6.03s/it]Evaluating:  70%|███████   | 278/395 [40:54<11:49,  6.06s/it]Evaluating:  71%|███████   | 279/395 [41:10<17:38,  9.13s/it]Evaluating:  71%|███████   | 280/395 [41:14<14:18,  7.47s/it]Evaluating:  71%|███████   | 281/395 [41:18<12:25,  6.54s/it]Evaluating:  71%|███████▁  | 282/395 [41:35<17:59,  9.55s/it]Evaluating:  72%|███████▁  | 283/395 [41:40<15:22,  8.24s/it]Evaluating:  72%|███████▁  | 284/395 [41:46<14:04,  7.61s/it]Evaluating:  72%|███████▁  | 285/395 [41:54<14:09,  7.72s/it]Evaluating:  72%|███████▁  | 286/395 [41:59<12:46,  7.04s/it]Evaluating:  73%|███████▎  | 287/395 [42:03<10:52,  6.04s/it]Evaluating:  73%|███████▎  | 288/395 [42:10<11:00,  6.17s/it]Evaluating:  73%|███████▎  | 289/395 [42:16<10:54,  6.18s/it]Evaluating:  73%|███████▎  | 290/395 [42:28<13:52,  7.93s/it]Evaluating:  74%|███████▎  | 291/395 [42:32<11:41,  6.75s/it]Evaluating:  74%|███████▁  | 292/395 [42:48<16:31,  9.62s/it]Evaluating:  74%|███████▁  | 293/395 [42:52<13:17,  7.82s/it]Evaluating:  74%|███████▁  | 294/395 [42:57<11:55,  7.08s/it]Evaluating:  75%|███████▁  | 295/395 [43:04<11:31,  6.92s/it]Evaluating:  75%|███████▁  | 296/395 [43:15<13:29,  8.17s/it]Evaluating:  75%|███████▌  | 297/395 [43:23<13:34,  8.31s/it]Evaluating:  75%|███████▌  | 298/395 [43:42<18:16, 11.31s/it]Evaluating:  76%|███████▌  | 299/395 [43:55<19:00, 11.88s/it]Evaluating:  76%|███████▌  | 300/395 [44:00<15:37,  9.86s/it]Evaluating:  76%|███████▌  | 301/395 [44:10<15:32,  9.92s/it]Evaluating:  76%|███████▋  | 302/395 [44:22<16:24, 10.59s/it]Evaluating:  77%|███████▋  | 303/395 [44:33<16:09, 10.53s/it]Evaluating:  77%|███████▋  | 304/395 [44:48<18:03, 11.90s/it]Evaluating:  77%|███████▋  | 305/395 [44:56<16:05, 10.72s/it]Evaluating:  77%|███████▋  | 306/395 [45:14<19:03, 12.85s/it]Evaluating:  78%|███████▊  | 307/395 [45:19<15:26, 10.53s/it]Evaluating:  78%|███████▊  | 308/395 [45:28<14:53, 10.27s/it]Evaluating:  78%|███████▊  | 309/395 [45:35<13:13,  9.23s/it]Evaluating:  78%|███████▊  | 310/395 [45:44<12:45,  9.01s/it]Evaluating:  79%|███████▊  | 311/395 [45:49<11:06,  7.94s/it]Evaluating:  79%|███████▉  | 312/395 [45:54<09:52,  7.14s/it]Evaluating:  79%|███████▉  | 313/395 [46:00<09:03,  6.63s/it]Evaluating:  79%|███████▉  | 314/395 [46:07<09:19,  6.91s/it]Evaluating:  80%|███████▉  | 315/395 [46:13<08:45,  6.56s/it]Evaluating:  80%|████████  | 316/395 [46:18<08:00,  6.08s/it]Evaluating:  80%|████████  | 317/395 [46:25<08:14,  6.34s/it]Evaluating:  81%|████████  | 318/395 [46:36<10:05,  7.87s/it]Evaluating:  81%|████████  | 319/395 [46:56<14:23, 11.37s/it]Evaluating:  81%|████████  | 320/395 [47:05<13:25, 10.74s/it]Evaluating:  81%|████████▁ | 321/395 [47:10<11:01,  8.94s/it]Evaluating:  82%|████████▁ | 322/395 [47:19<10:59,  9.04s/it]Evaluating:  82%|████████▁ | 323/395 [47:28<10:46,  8.98s/it]Evaluating:  82%|████████▁ | 324/395 [47:39<11:11,  9.46s/it]Evaluating:  82%|████████▁ | 325/395 [47:45<09:49,  8.43s/it]Evaluating:  83%|████████▎ | 326/395 [47:53<09:38,  8.39s/it]Evaluating:  83%|████████▎ | 327/395 [48:00<09:00,  7.95s/it]Evaluating:  83%|████████▎ | 328/395 [48:07<08:35,  7.69s/it]Evaluating:  83%|████████▎ | 329/395 [48:15<08:25,  7.66s/it]Evaluating:  84%|████████▎ | 330/395 [48:19<07:20,  6.78s/it]Evaluating:  84%|████████▁ | 331/395 [48:26<07:14,  6.79s/it]Evaluating:  84%|████████▁ | 332/395 [48:30<06:02,  5.75s/it]Evaluating:  84%|████████▁ | 333/395 [48:36<06:11,  5.99s/it]Evaluating:  85%|████████▁ | 334/395 [48:41<05:55,  5.82s/it]Evaluating:  85%|████████▁ | 335/395 [48:46<05:32,  5.55s/it]Evaluating:  85%|████████▌ | 336/395 [48:54<06:10,  6.28s/it]Evaluating:  85%|████████▌ | 337/395 [48:58<05:19,  5.51s/it]Evaluating:  86%|████████▌ | 338/395 [49:10<07:03,  7.43s/it]Evaluating:  86%|████████▌ | 339/395 [49:26<09:12,  9.86s/it]Evaluating:  86%|████████▌ | 340/395 [49:38<09:37, 10.51s/it]Evaluating:  86%|████████▋ | 341/395 [49:58<12:06, 13.45s/it]Evaluating:  87%|████████▋ | 342/395 [50:13<12:13, 13.84s/it]Evaluating:  87%|████████▋ | 343/395 [50:18<09:51, 11.37s/it]Evaluating:  87%|████████▋ | 344/395 [50:30<09:44, 11.47s/it]Evaluating:  87%|████████▋ | 345/395 [50:44<10:06, 12.13s/it]Evaluating:  88%|████████▊ | 346/395 [50:57<10:13, 12.51s/it]Evaluating:  88%|████████▊ | 347/395 [51:07<09:21, 11.70s/it]Evaluating:  88%|████████▊ | 348/395 [51:13<07:57, 10.16s/it]Evaluating:  88%|████████▊ | 349/395 [51:18<06:24,  8.37s/it]Evaluating:  89%|████████▊ | 350/395 [51:26<06:19,  8.44s/it]Evaluating:  89%|████████▉ | 351/395 [51:37<06:48,  9.28s/it]Evaluating:  89%|████████▉ | 352/395 [51:48<07:02,  9.83s/it]Evaluating:  89%|████████▉ | 353/395 [51:53<05:43,  8.17s/it]Evaluating:  90%|████████▉ | 354/395 [51:57<04:49,  7.06s/it]Evaluating:  90%|████████▉ | 355/395 [52:06<05:04,  7.61s/it]Evaluating:  90%|█████████ | 356/395 [52:40<09:59, 15.37s/it]Evaluating:  90%|█████████ | 357/395 [52:44<07:38, 12.06s/it]Evaluating:  91%|█████████ | 358/395 [52:51<06:27, 10.48s/it]Evaluating:  91%|█████████ | 359/395 [52:58<05:44,  9.56s/it]Evaluating:  91%|█████████ | 360/395 [53:04<04:51,  8.32s/it]Evaluating:  91%|█████████▁| 361/395 [53:11<04:28,  7.91s/it]Evaluating:  92%|█████████▁| 362/395 [53:16<03:52,  7.05s/it]Evaluating:  92%|█████████▁| 363/395 [53:21<03:34,  6.70s/it]Evaluating:  92%|█████████▁| 364/395 [53:32<04:01,  7.80s/it]Evaluating:  92%|█████████▁| 365/395 [53:36<03:19,  6.65s/it]Evaluating:  93%|█████████▎| 366/395 [53:42<03:13,  6.66s/it]Evaluating:  93%|█████████▎| 367/395 [53:58<04:24,  9.46s/it]Evaluating:  93%|█████████▎| 368/395 [54:08<04:12,  9.35s/it]Evaluating:  93%|█████████▎| 369/395 [54:23<04:51, 11.21s/it]Evaluating:  94%|█████████▎| 370/395 [54:34<04:34, 10.98s/it]Evaluating:  94%|█████████▁| 371/395 [54:38<03:36,  9.04s/it]Evaluating:  94%|█████████▁| 372/395 [54:45<03:15,  8.50s/it]Evaluating:  94%|█████████▁| 373/395 [54:51<02:47,  7.62s/it]Evaluating:  95%|█████████▁| 374/395 [54:56<02:23,  6.84s/it]Evaluating:  95%|█████████▁| 375/395 [55:05<02:30,  7.54s/it]Evaluating:  95%|█████████▌| 376/395 [55:14<02:30,  7.91s/it]Evaluating:  95%|█████████▌| 377/395 [55:20<02:10,  7.26s/it]Evaluating:  96%|█████████▌| 378/395 [55:24<01:49,  6.43s/it]Evaluating:  96%|█████████▌| 379/395 [55:30<01:39,  6.21s/it]Evaluating:  96%|█████████▌| 380/395 [55:37<01:35,  6.37s/it]Evaluating:  96%|█████████▋| 381/395 [55:50<01:59,  8.52s/it]Evaluating:  97%|█████████▋| 382/395 [55:59<01:52,  8.69s/it]Evaluating:  97%|█████████▋| 383/395 [56:10<01:53,  9.48s/it]Evaluating:  97%|█████████▋| 384/395 [56:19<01:42,  9.29s/it]Evaluating:  97%|█████████▋| 385/395 [56:29<01:34,  9.41s/it]Evaluating:  98%|█████████▊| 386/395 [56:34<01:13,  8.19s/it]Evaluating:  98%|█████████▊| 387/395 [56:42<01:04,  8.12s/it]Evaluating:  98%|█████████▊| 388/395 [56:53<01:01,  8.82s/it]Evaluating:  98%|█████████▊| 389/395 [57:05<00:58,  9.76s/it]Evaluating:  99%|█████████▊| 390/395 [57:15<00:49,  9.99s/it]Evaluating:  99%|█████████▉| 391/395 [57:20<00:33,  8.48s/it]Evaluating:  99%|█████████▉| 392/395 [57:25<00:21,  7.27s/it]Evaluating:  99%|█████████▉| 393/395 [57:30<00:13,  6.56s/it]Evaluating: 100%|█████████▉| 394/395 [57:36<00:06,  6.63s/it]Evaluating: 100%|██████████| 395/395 [57:43<00:00,  6.64s/it]Evaluating: 100%|██████████| 395/395 [57:43<00:00,  8.77s/it]

Progress: 5/395, Accuracy so far: 0.2000 (20.00%)

Progress: 10/395, Accuracy so far: 0.4000 (40.00%)

Progress: 15/395, Accuracy so far: 0.4667 (46.67%)

Progress: 20/395, Accuracy so far: 0.4500 (45.00%)

Progress: 25/395, Accuracy so far: 0.4800 (48.00%)

Progress: 30/395, Accuracy so far: 0.5000 (50.00%)

Progress: 35/395, Accuracy so far: 0.5429 (54.29%)

Progress: 40/395, Accuracy so far: 0.6000 (60.00%)

Progress: 45/395, Accuracy so far: 0.5556 (55.56%)

Progress: 50/395, Accuracy so far: 0.5600 (56.00%)

Progress: 55/395, Accuracy so far: 0.5636 (56.36%)

Progress: 60/395, Accuracy so far: 0.5833 (58.33%)

Progress: 65/395, Accuracy so far: 0.5846 (58.46%)

Progress: 70/395, Accuracy so far: 0.6000 (60.00%)

Progress: 75/395, Accuracy so far: 0.5600 (56.00%)

Progress: 80/395, Accuracy so far: 0.5625 (56.25%)

Progress: 85/395, Accuracy so far: 0.5647 (56.47%)

Progress: 90/395, Accuracy so far: 0.5778 (57.78%)

Progress: 95/395, Accuracy so far: 0.5789 (57.89%)

Progress: 100/395, Accuracy so far: 0.5600 (56.00%)

Progress: 105/395, Accuracy so far: 0.5619 (56.19%)

Progress: 110/395, Accuracy so far: 0.5818 (58.18%)

Progress: 115/395, Accuracy so far: 0.5739 (57.39%)

Progress: 120/395, Accuracy so far: 0.5667 (56.67%)

Progress: 125/395, Accuracy so far: 0.5760 (57.60%)

Progress: 130/395, Accuracy so far: 0.5769 (57.69%)

Progress: 135/395, Accuracy so far: 0.5778 (57.78%)

Progress: 140/395, Accuracy so far: 0.5786 (57.86%)

Progress: 145/395, Accuracy so far: 0.5862 (58.62%)

Progress: 150/395, Accuracy so far: 0.5933 (59.33%)

Progress: 155/395, Accuracy so far: 0.5935 (59.35%)

Progress: 160/395, Accuracy so far: 0.5813 (58.13%)

Progress: 165/395, Accuracy so far: 0.5818 (58.18%)

Progress: 170/395, Accuracy so far: 0.5824 (58.24%)

Progress: 175/395, Accuracy so far: 0.5829 (58.29%)

Progress: 180/395, Accuracy so far: 0.5722 (57.22%)

Progress: 185/395, Accuracy so far: 0.5676 (56.76%)

Progress: 190/395, Accuracy so far: 0.5632 (56.32%)

Progress: 195/395, Accuracy so far: 0.5590 (55.90%)

Progress: 200/395, Accuracy so far: 0.5550 (55.50%)

Progress: 205/395, Accuracy so far: 0.5561 (55.61%)

Progress: 210/395, Accuracy so far: 0.5619 (56.19%)

Progress: 215/395, Accuracy so far: 0.5581 (55.81%)

Progress: 220/395, Accuracy so far: 0.5591 (55.91%)

Progress: 225/395, Accuracy so far: 0.5511 (55.11%)

Progress: 230/395, Accuracy so far: 0.5478 (54.78%)

Progress: 235/395, Accuracy so far: 0.5447 (54.47%)

Progress: 240/395, Accuracy so far: 0.5458 (54.58%)

Progress: 245/395, Accuracy so far: 0.5429 (54.29%)

Progress: 250/395, Accuracy so far: 0.5440 (54.40%)

Progress: 255/395, Accuracy so far: 0.5451 (54.51%)

Progress: 260/395, Accuracy so far: 0.5500 (55.00%)

Progress: 265/395, Accuracy so far: 0.5509 (55.09%)

Progress: 270/395, Accuracy so far: 0.5519 (55.19%)

Progress: 275/395, Accuracy so far: 0.5491 (54.91%)

Progress: 280/395, Accuracy so far: 0.5429 (54.29%)

Progress: 285/395, Accuracy so far: 0.5439 (54.39%)

Progress: 290/395, Accuracy so far: 0.5483 (54.83%)

Progress: 295/395, Accuracy so far: 0.5525 (55.25%)

Progress: 300/395, Accuracy so far: 0.5567 (55.67%)

Progress: 305/395, Accuracy so far: 0.5541 (55.41%)

Progress: 310/395, Accuracy so far: 0.5484 (54.84%)

Progress: 315/395, Accuracy so far: 0.5524 (55.24%)

Progress: 320/395, Accuracy so far: 0.5469 (54.69%)

Progress: 325/395, Accuracy so far: 0.5508 (55.08%)

Progress: 330/395, Accuracy so far: 0.5485 (54.85%)

Progress: 335/395, Accuracy so far: 0.5463 (54.63%)

Progress: 340/395, Accuracy so far: 0.5500 (55.00%)

Progress: 345/395, Accuracy so far: 0.5507 (55.07%)

Progress: 350/395, Accuracy so far: 0.5486 (54.86%)

Progress: 355/395, Accuracy so far: 0.5549 (55.49%)

Progress: 360/395, Accuracy so far: 0.5528 (55.28%)

Progress: 365/395, Accuracy so far: 0.5534 (55.34%)

Progress: 370/395, Accuracy so far: 0.5541 (55.41%)

Progress: 375/395, Accuracy so far: 0.5547 (55.47%)

Progress: 380/395, Accuracy so far: 0.5500 (55.00%)

Progress: 385/395, Accuracy so far: 0.5506 (55.06%)

Progress: 390/395, Accuracy so far: 0.5462 (54.62%)

Progress: 395/395, Accuracy so far: 0.5494 (54.94%)

======================================================================
📈 Final Evaluation Results (GRPO Model):
======================================================================
Total samples: 395
Correct predictions: 217
Wrong predictions: 178
Accuracy: 0.5494 (54.94%)
======================================================================

✅ Inference results saved to: inference_results_grpo/inference_results.json
✅ Evaluation metrics saved to: inference_results_grpo/evaluation_metrics.json
✅ Wrong cases saved to: inference_results_grpo/wrong_cases.json
   Total wrong cases: 178

======================================================================
 Sample Results:
======================================================================

✅ Correct Example (Index 1):
Question: Ann, Becky, and Julia are working at a pharmacy, every day for 8 hours. Each of them is providing se...
Predicted: 154
Ground Truth: 154

❌ Wrong Example (Index 0):
Question: There are 8 loads of laundry that need to be washed. Each load of laundry takes around 45 minutes to...
Predicted: 14
Ground Truth: ### Final Answer:
Full Response: To find the total time, we need to calculate the time for both the wash and dry cycles for all 8 loads of laundry.
The wash cycle takes 45 minutes per load, so for 8 loads, it will take 8 * 45 = 360 m...

======================================================================
🎉 GRPO Model Inference and Evaluation Completed!
======================================================================

==========================================
✅ Inference completed successfully!
 Results saved in: inference_results_grpo/
Job finished at: Fri Oct 31 01:16:02 PDT 2025
==========================================

